"DESCRIPTION","DURATION IN MS","NAME","PARENT SUITE","START TIME","STATUS","STOP TIME","SUB SUITE","SUITE","TEST CLASS","TEST METHOD"
"","507","Should not be able to add Note without title","chromium","Sun Mar 08 20:13:38 UTC 2026","passed","Sun Mar 08 20:13:39 UTC 2026","Notes App e2e flow","","",""
"","379","Should be able to logout","chromium","Sun Mar 08 20:13:39 UTC 2026","passed","Sun Mar 08 20:13:39 UTC 2026","Notes App e2e flow","","",""
"","94528","should see user successfully logged in","chromium","Sun Mar 08 20:11:55 UTC 2026","passed","Sun Mar 08 20:13:29 UTC 2026","Notes App Login","","",""
"","1981","Should be able to Edit a Note","chromium","Sun Mar 08 20:13:36 UTC 2026","passed","Sun Mar 08 20:13:38 UTC 2026","Notes App e2e flow","","",""
"","37","Should be able to Delete a Note","chromium","Sun Mar 08 20:13:38 UTC 2026","passed","Sun Mar 08 20:13:38 UTC 2026","Notes App e2e flow","","",""
"","1971","Should be able to Add a Note","chromium","Sun Mar 08 20:13:34 UTC 2026","passed","Sun Mar 08 20:13:36 UTC 2026","Notes App e2e flow","","",""
"","3736","Should be able to register new user","chromium","Sun Mar 08 20:13:39 UTC 2026","passed","Sun Mar 08 20:13:43 UTC 2026","User Registration","","",""
"","1197","should see error message when login fails","chromium","Sun Mar 08 20:13:29 UTC 2026","passed","Sun Mar 08 20:13:31 UTC 2026","Notes App Login","","",""
"","2327","Should not be able to register with existing username","chromium","Sun Mar 08 20:13:43 UTC 2026","passed","Sun Mar 08 20:13:45 UTC 2026","User Registration","","",""
"","2570","Should see notes page login","chromium","Sun Mar 08 20:13:32 UTC 2026","passed","Sun Mar 08 20:13:34 UTC 2026","Notes App e2e flow","","",""
